{"candidate_revision":"candidate-1","checks":{"impact":{"outcome":"valid","reasons":[]},"lineage":{"outcome":"valid","reasons":[]},"record":{"outcome":"valid","reasons":[]},"review":{"outcome":"valid","reasons":[]}},"decision_event":{"chain_tail_hash":"74354c47c65403264b016c5b804e0fcaf3aee0a5cb69cddfc6e1cbd6f9d350c2","decision":"approved","event_hash":"74354c47c65403264b016c5b804e0fcaf3aee0a5cb69cddfc6e1cbd6f9d350c2","event_id":"event-1","recorded_actor":"reviewer","run_id":"run-1"},"digest":"1804806b390882babce092f6f1671438e3ed0e2e1ef6593650155276e1a24da2","outcome":"valid","parent_digests":[],"proofs":[{"attestation_digest":"bfd642acad50e6ed82d63a92e51cac22857e7fe8c6e2cd04fb573e61868b1adc","audit_findings":[],"audit_report_digest":"aaaaaaaaaaaaaaaaaaaaaaaaaaaaaaaaaaaaaaaaaaaaaaaaaaaaaaaaaaaaaaaa","obligation_ids":["FR-068-AC-1"],"outcome":"valid","proof_id":"proof-1","reasons":[],"retained_output_digest":"b576bf327e110a373629f7f0c0ae4aa92f13025760d0a5568271bf9f53174687"}],"reasons":[],"record_digest":"1972d0d5d3ee3fb06a2a8ca2cc97f3e239d956958368d209ebbe0a52f9b61630","record_type":"verification_receipt","schema_version":1,"unknowns":[]}
